Name,Description,key
DevOps-инженер: быстрый старт в профессии,"На практике научитесь понимать фундаментальные алгоритмы и использовать их для решения задач. Вы сможете писать сайты, приложения, нейросети и программы для научных исследований, Telegram-бота. Вы сможете трудоустроиться после 9 месяцев обучения.",['Ethernet','Unix','CI/CD','Docker','Zabbix']
Python-разработчик: быстрый старт в профессии,На курсе вы узнаете, как создавать телеграм-ботов, сайты, приложения, нейросети и использовать Python для научных исследований — теория и практика на реальных задачах,['Python','SQL','Django','NoSQL','Git']
Редактор,Станьте специалистом по продвижению товаров и брендов с помощью текстов. Научитесь писать для любой аудитории и любых целей, а также решать задачи бизнеса.Вы освоите на практике подготовку текстов для рекламных кампаний, разработку лендингов на Tilda и составление контент-плана. Научитесь продвигать продукты с помощью текстов, которые невозможно не прочитать. Начать можно без опыта, а найти первую работу — уже через 9 месяцев после старта обучения.,['YouTube','Tilda','Miro','Trello','Яндекс.Метрика']
Fullstack-дизайнер,Вы на практике получите навыки в дизайне, верстке, 3D-моделировании и SEO-оптимизации, научитесь работать с Photoshop, Illustrator, Figma, Tilda, After Effects,['Adobe Photoshop','Adobe Illustrator','Figma','Tilda','After Effects']
Менеджер маркетплейсов: быстрый старт в профессии,Станьте специалистом в области продвижения товаров на маркетплейсах. Научитесь формировать товарную и ассортиментную матрицы, выводить бизнес на российские и зарубежные маркетплейсы, работать с юнит-экономикой товара, продвигать свое предложение на маркетплейсах и анализировать статистику. Начать обучение можно без опыта, а найти первую работу — уже спустя 9 месяцев со старта курса.,['Ozon','Wildberries','Яндекс.Маркет','JoomPro','Sellmonitor','MarketGuru','Юнит-экономика']
Frontend-разработчик: быстрый старт в профессии,Научитесь создавать сайты и веб-сервисы с помощью HTML, CSS, JavaScript, библиотек React и Redux,['HTML','CSS','JavaScript','Vue','Node.js','WebSocket','Bootstrap']
UI/UX-дизайнер,Вы научитесь проектировать дизайн интерфейсов, удобных для пользователей и эффективных для бизнеса. Откроете для себя новое творческое направление с перспективами роста и сможете работать из любой точки мира.,['Figma','Adobe Photoshop','Tilda','ArchiCAD','3ds Max','Adobe InDesign','AutoCAD']
Менеджер маркетплейсов с нуля до Junior,Станьте специалистом в области продвижения товаров на маркетплейсах. Научитесь формировать товарную и ассортиментную матрицы, выводить бизнес на российские и зарубежные маркетплейсы, работать с юнит-экономикой товара, продвигать свое предложение на маркетплейсах и анализировать статистику. Начать обучение можно без опыта, а найти первую работу — уже спустя 9 месяцев со старта курса.,['Ozon','Wildberries','Яндекс.Маркет','MarketGuru']
3D-художник,Станьте тем, кто создает 3D-модели для кино и игр. Научитесь создавать окружения и персонажей, настраивать сцены и создавать текстуры. Изучите основные программы для работы с 3D, пополните портфолио проектами и обучайтесь у экспертов, которые создавали Overwatch, Star Wars и Fortnite.,['Autodesk Maya','Blender','Houdini','ZBrush','Photoshop','Substance 3D Painter']
SEO-специалист,Вы изучите основы маркетинга: от иследования рынка и проработки идеи продукта до UX- исследований и презентации их результатов заказчику. После — погрузитесь в изучение SEO-продвижения, получите профильные навыки и начнете карьеру.,['Яндекс.Директ','Яндекс.Метрика','Google Analytics','Google Ads','Google Search Console']
Финансовый аналитик,Станьте профессиональным финансовым аналитиком и получите одну из самых востребованных профессий. На программе Вы научитесь собирать и обрабатывать данные, визуализировать и интерпретировать их. Получите знания по основам создания и развития процессов, финансовых, функциональных и бизнес-моделей деятельности. Научитесь формировать метрики и показатели и работать с ними. Сможете превращать информацию в понятные отчеты и графики, делать выводы на ее основе, помогая специалистам создавать системы и принимать решения на основе данных.,['MS Excel','1C','Tableau','SQL','SAP']
Разработчик: старт в ИТ с нуля до Junior,"Вы изучите основы программирования и основные концепции компьютерных наук, цифровые технологии, операционные системы, программное обеспечение, базы данных, системы аналитики, языки программирования и многое другое. Познакомитесь с тестированием и системным анализом. На программе сможете сделать осознанный выбор специализации и технологий, прокачаться в выбранном направлении.",['Python','SQL','Java','C++','C','Selenium','Git','Linux','TCP/IP','ANNs','GAN']
Специалист по автоматизированному тестированию,Получите востребованную профессию инженера по автоматизированному тестированию на Python навыки для тестирования мобильных и веб-приложений.‍ На программе Вы изучите основы ручного и автоматизированного тестирования, научитесь быстро находить баги, разрабатывать тест-кейсы, работать с баг-трекинговыми системами, создавать эффективные тестовые сценарии. Вы также изучите основы программирования, необходимые для написания автотестов и настройки систем автоматизированного тестирования. И, если захотите, сможете продолжить развиваться в программировании.,['Python','SQL','Java','Spring','JUnit','Selenium','X-Path','CI/CD','JavaScript','REST']
Веб-дизайнер,Станьте веб-дизайнером с нуля. Вы изучите основы композиции, типографики, верстки и UX, научитесь работать в Figma, Photoshop, Tilda, получите опыт в создании сайтов и интернет-магазинов на практике. В результате станете квалифицированным веб-дизайнером и сможете гарантированно трудоустроиться,['Figma','Tilda','Adobe Photoshop']
Разработчик на C++: быстрый старт в профессии,Вы изучите на практике, как работать с языком программирования C++, его библиотеками и инструментами, освоите алгоритмы и структуры данных, необходимые для разработки программных продуктов, получите опыт работы с популярными платформами,['Сmake','C++','SQL','Docker']
Дизайнер с нуля до Junior,"На практике освойте визуальную архитектуру контента, подготовку текстов для социальных сетей и составление контент-плана. Научитесь находить клиентов, работать с заказчиком и успешно закрывать сделки. Начать можно без опыта, а найти первую работу — уже после 9 месяцев обучения.",['Figma','Tilda','Adobe Photoshop','ArchiCAD','SketchUp']
SMM-менеджер с нуля до Junior,Станьте специалистом по продвижению бренда в соцсетях. Научитесь разрабатывать стратегию с нуля, использовать инфоповоды и генерировать идеи для вирусного контента. На практике освойте визуальную архитектуру контента, подготовку текстов для социальных сетей и составление контент-плана. Научитесь находить клиентов, работать с заказчиком и успешно закрывать сделки. Начать можно без опыта, а найти первую работу — уже после 9 месяцев обучения.,['Яндекс.Метрика','TargetHunter','Vk','Telegram']
Сетевой инженер,Вы научитесь настраивать оборудование и протоколы маршрутизации, проектировать безопасные и масштабируемые сети для бизнеса, автоматизировать рутинную работу.,['Python','Linux','TCP/IP','FHRP','STP','BGP','OSPF']
Java-разработчик с нуля до Middle,Пройдите обучение на инженера-программиста на Java. Вы получите базовые знания алгоритмы, на практике освоите язык Java и сможете создавать универсальные программы для большинства современных платформ: сетевые чаты, приложения, мобильные игры и другие сервисы. После 9 месяцев обучения вы сможете трудоустроиться. В пакете Мастер вы получаете возможность углубленно изучить технологическую специализацию с экспертной поддержкой.,['Java','SQL','Spring','Ethernet','LibGDX','NoSQL','Git']
Разработчик на C#: быстрый старт в профессии,Станьте инженером-программистом C#.‍ Вы сможете написать игру, сайт, мобильное приложение или многопоточный сервис. Изучите основы этого универсального языка. На практике освоите алгоритмы и структуры данных, а также объектно-ориентированное программирование для С#. Получите практические навыки разработки веб-сервисов и приложений для работы, на которую вы сможете устроиться после 9 месяцев обучения.,['C#','ASP.NET','SOAP','gRPC','.NET']
Frontend-разработчик с нуля до Middle,Станьте Frontend-разработчиком, который специализируется на внешнем оформлении сайтов. Вы получите базовые знания и на практике научитесь создавать сайты и приложения, проектировать интерфейсы и работать со сложными инструментами frontend-разработчика. Изучите фреймворки и библиотеки, которые упростят вашу работу. Через 9 месяцев обучения вы сможете трудоустроиться. В пакете Мастер вы получаете возможность углубленно изучить технологическую специализацию с экспертной поддержкой.,['JavaScript','NodeJS','Vue.js','TypeScript','ReactJS','Angular','Redux','Webpack']
Профессия DevOps-инженер,DevOps-инженер занимается автоматизацией процессов IT-разработки. Он помогает разработчикам, тестировщикам и системным администраторам работать быстрее и эффективнее.,['Ethernet','Unix','DNS','Zabbix','Kubernetes (K8s)','ELK','Docker']
Backend-разработчик,Научим создавать веб-приложения на языке Python, работать с базами данных и сервером,['Python','Django','Flask','FastAPI','Docker','Linux']
Android-разработчик с нуля до Junior,Станьте востребованным разработчиком приложений для устройств на Android. Вы изучите основы программирования и основные концепции компьютерных наук, цифровые технологии, операционные системы, программное обеспечение, базы данных, системы аналитики, языки программирования и многое другое. Познакомитесь с тестированием и системным анализом. На программе сможете сделать осознанный выбор специализации и технологий, прокачаться в выбранном направлении.,['Java','Kotlin','Android SDK','JUnit','JavaScript','CSQL','C++']
Тестировщик ПО,Став тестировщиком вы сможете составлять тест-планы и тест-кейсы для поиска ошибок и уязвимостей в программах, проверить их качество и смоделировать ситуации, которые могут возникнуть во время их использования.На программе так же познакомитесь с базовыми понятиями в программировании, узнаете, какие бывают виды тестирования, разберетесь и узнаете на практике, как устроено ручное тестирование, проверив на ошибки и баги несколько проектов.,['JavaScript','HTML','CSS','DevTools']
BI-аналитик,Станьте профессиональным BI (Business Intelligence) аналитиком и получите одну из самых востребованных профессий. На программе Вы научитесь собирать и обрабатывать данные, визуализировать и интерпретировать их. Получите знания по основам построения финансовых, функциональных и бизнес-моделей деятельности. Научитесь формировать метрики и показатели и работать с ними. Сможете превращать информацию в понятные отчеты и графики, делать выводы на ее основе, помогая специалистам создавать системы и принимать управленческие решения на основе данных.,['Python','SQL','NoSQL','NumPy','Matplotlib','Scikit-learn','Hadoop','Power BI']
